{
  "treatment_timing": "time_varying",
  "data_format": "long",
  "time_grid_defined": true,
  "n_time_points": 6,
  "strategy_type": "static_sustained",
  "target": "strategy_contrast",
  "treatment_type": "binary",
  "time_varying_confounding": "present",
  "confounders_affected_by_prior_treatment": true,
  "censoring_status": "informative",
  "positivity_status": "limited",
  "outcome_type": "survival_time",
  "sample_size": 4200,
  "n_ids": 900,
  "high_dimensional": false,
  "needs_absolute_risk": true,
  "needs_interpretability": true,
  "language": "either"
}
